{
  "id": "2026-09-13-all-hands-internalization",
  "created_at": "2026-09-13T00:00:00+08:00",
  "method": "three same-role clones plus one related business stakeholder",
  "budget": {
    "model_requested": "gpt-5.3-codex-spark",
    "allocation_mode": "target",
    "per_role_percent": 10,
    "role_count": 8,
    "aggregate_target_percent": 80,
    "execution_status": "failed_model_gate",
    "cap_percent": 10,
    "actual_model": "inherited model; not gpt-5.3-codex-spark",
    "actual_reasoning": "unknown",
    "actual_usage": 0,
    "usage_snapshot": {
      "limit_id": "codex_bengalfox",
      "before_percent": "not_recorded",
      "after_percent": 0,
      "delta_percent": 0,
      "captured_at": "2026-09-13T21:12:09+08:00",
      "note": "The post-run five-hour and weekly Spark windows were both 0 percent; no pre-run snapshot was recorded."
    },
    "note": "This content run used inherited non-Spark subagents and does not satisfy the requested Spark execution."
  },
  "source_snapshot": [
    {"role_id": "chief-of-staff", "path": "employees/chief-of-staff/KNOWLEDGE.md", "sha256": "48f795900c7454a256b6c25f154db8a4723c3ec8fc94b43bb5e852fe32006d2d"},
    {"role_id": "product-manager", "path": "employees/product-manager/KNOWLEDGE.md", "sha256": "e0b5e6f76658df8292ac9d678261560b17bb34625edd86031911d00ce4acbc10"},
    {"role_id": "frontend-expert", "path": "employees/frontend-expert/KNOWLEDGE.md", "sha256": "92715bbb8f1cd0565c87a5713881b8cb132063a4e920d4445e69a761e8d22876"},
    {"role_id": "backend-expert", "path": "employees/backend-expert/KNOWLEDGE.md", "sha256": "2a26573bad4a0324cba4163fb9417693933fb08af426c35931bd7ff6ef4d0128"},
    {"role_id": "design-master", "path": "employees/design-master/KNOWLEDGE.md", "sha256": "6ffa2d5611d84bd23f1c3d4e6dd461607153ee3f654bd261ebed72795323f87c"},
    {"role_id": "test-expert", "path": "employees/test-expert/KNOWLEDGE.md", "sha256": "c16f10b3a88fdf8377d22591eeb476d003012360f7d0746310f3130786e6d9d5"},
    {"role_id": "ai-engineer", "path": "employees/ai-engineer/KNOWLEDGE.md", "sha256": "1fa0432f2a99bd0e27c6ac4a2b6b1d03f49e53edd0291d6f3c683f2a4587b9e4"},
    {"role_id": "backend-training-architect", "path": "employees/backend-training-architect/KNOWLEDGE.md", "sha256": "a30cd62bd716144ae414551098c2af1eefe6110a9337486c30646a3604783512"}
  ],
  "employees": [
    {
      "role_id": "chief-of-staff",
      "display_name": "陈知行 · 路由官",
      "clones": [
        {"role": "experience_miner", "conclusion": "按影响、依赖、可逆性和敏感性分级；实现、验证、发布分别记事实。"},
        {"role": "boundary_challenger", "conclusion": "文件数和参与人数不能机械决定等级；顾问署名不等于发生协作。"},
        {"role": "transfer_architect", "conclusion": "把路由经验抽象成风险信号、权限边界、证据层级和停止条件。"}
      ],
      "business_stakeholder": {
        "role_id": "test-expert",
        "question": "若三个分支各自测试通过，你能否宣布集成交付完成？谁验证权限和最终版本？",
        "response": "不能。还需取得真实环境、敏感数据、可逆性和授权边界；这些事实未确认前只完成分级草案。"
      },
      "experience_unit": {
        "trigger": "新任务路由、任务升级或完成声明",
        "signals": ["影响范围", "组件依赖", "可逆性", "数据与权限", "实际参与者", "验收主张"],
        "decision": "任务等级和完成状态由风险与证据决定，不由工作量表象决定。",
        "action": ["核实事实", "判定S/M/L", "明确主责与实际协作者", "拆分实现验证发布", "在原事件收口"],
        "evidence": [
          {"level": "reviewed_case", "path": "employees/chief-of-staff/KNOWLEDGE.md", "claim": "分级交付和实际参与者原则"},
          {"level": "reviewed_case", "path": "learning/2026-09-11-delivery-retraining.md", "claim": "双向案例与审查修订"}
        ],
        "limits": "不以集体意见扩大权限；案例原则不证明真实提效。",
        "counterexample": "一行敏感日志改动可能是L，跨多目录的纯文本更名仍可能是S。",
        "transfer_test": {
          "variation_axes": ["变更规模与风险反向", "多分支到集成版本"],
          "question": "一个跨五目录的文案修正和一个单行生产权限放宽同时到达，应如何分级与验收？",
          "initial_answer": "拆成两项：跨五目录同目标文案可判S；生产权限放宽判L，分别验收。环境事实未核实则权限项停止并记unknown。",
          "challenge": "测试相关者指出权限影响远高于文件数，且两个请求不能捆绑证明完成。",
          "revision": "文案按S独立验收；权限改动按L确认授权、回退和生产证据，两个状态分开记录。",
          "result": "held"
        }
      },
      "outcome_status": "held"
    },
    {
      "role_id": "product-manager",
      "display_name": "林知夏 · 目标规划官",
      "clones": [
        {"role": "experience_miner", "conclusion": "先定义用户问题、基线、目标指标、护栏和停止条件。"},
        {"role": "boundary_challenger", "conclusion": "指标上涨不等于因果；同类样本仍可能混杂。"},
        {"role": "transfer_architect", "conclusion": "把产品经验抽象为目标、分母、可比性、护栏和授权五类信号。"}
      ],
      "business_stakeholder": {
        "role_id": "design-master",
        "question": "完成率提高但误操作和无障碍投诉上升时，你会用哪个指标宣布成功？",
        "response": "不宣布整体成功；分别报告完成率变化与护栏失败，复核样本和风险阈值。"
      },
      "experience_unit": {
        "trigger": "提出功能方案、看到指标变化或准备实验结论",
        "signals": ["用户决策", "基线", "分母", "人群与时间窗", "负向护栏", "实验授权"],
        "decision": "先确认问题与可比证据，再判断方案是否有效。",
        "action": ["定义目标与护栏", "核对样本可比性", "区分描述变化与因果", "证据不足保持unknown"],
        "evidence": [
          {"level": "reviewed_case", "path": "employees/product-manager/KNOWLEDGE.md", "claim": "问题定义与效果归因原则"},
          {"level": "reviewed_case", "path": "learning/2026-09-11-remaining-roles-retraining.md", "claim": "指标混杂迁移案例"}
        ],
        "limits": "合成指标不是项目结果；未经授权不自行上线实验。",
        "counterexample": "点击率上涨但流量结构改变、完成率下降且投诉增加，不应判定改版成功。",
        "transfer_test": {
          "variation_axes": ["主指标从点击率变为留存", "护栏从投诉变为高风险误操作"],
          "question": "AI摘要使次日留存上升，但高风险误操作翻倍且新老用户比例改变，能否推广？",
          "initial_answer": "不能推广；留存只是混杂后的观察，高风险误操作已触发护栏。分新老用户复核，因果与风险机制unknown。",
          "challenge": "设计相关者要求解释人群混杂和高风险护栏为何可以被忽略。",
          "revision": "只报告所观测留存变化；先分层复核样本并把高风险误操作作为阻断护栏，未经授权不扩量。",
          "result": "reviewed_case"
        }
      },
      "outcome_status": "reviewed_case"
    },
    {
      "role_id": "frontend-expert",
      "display_name": "周启明 · 体验工程官",
      "clones": [
        {"role": "experience_miner", "conclusion": "异步视图的data、error、loading必须共享请求所有权。"},
        {"role": "boundary_challenger", "conclusion": "request ID只保护前端状态，不能证明服务端幂等或权限正确。"},
        {"role": "transfer_architect", "conclusion": "按请求身份、状态域、副作用和生命周期四个变化轴迁移。"}
      ],
      "business_stakeholder": {
        "role_id": "backend-expert",
        "question": "前端禁止重复点击后，能否认为支付不会重复？取消请求在服务端是什么语义？",
        "response": "不能；退款单号是否为服务端稳定业务键、查询返回哪些业务终态都需核实，前端只能展示unknown和停止自动重试。"
      },
      "experience_unit": {
        "trigger": "搜索、筛选、切页或提交存在并发返回与多状态切换",
        "signals": ["请求身份", "受保护状态集合", "是否有副作用", "卸载和取消语义", "后端幂等契约"],
        "decision": "最新请求只能更新其拥有的视图状态；副作用可靠性由端到端契约另证。",
        "action": ["分配递增请求身份", "统一守护data/error/loading", "构造乱序与旧失败", "核对后端幂等"],
        "evidence": [
          {"level": "reviewed_case", "path": "employees/frontend-expert/KNOWLEDGE.md", "claim": "请求所有权与UI验证分层"},
          {"level": "verified_context", "path": "learning/exercises/vanke-request-ownership/README.md", "claim": "本地无框架最小乱序题执行证据，仅限该fixture"}
        ],
        "limits": "不外推到真实网络、框架生命周期或生产副作用；取消请求不独自保证正确性。",
        "counterexample": "支付页打开Debug并观察状态正常，仍不能证明金额、权限或重复扣款安全。",
        "transfer_test": {
          "variation_axes": ["读请求变写请求", "旧成功变旧超时后远端成功"],
          "question": "用户连续提交两次退款，第二次先返回成功，第一次前端超时但服务端随后成功，界面如何处理？",
          "initial_answer": "按稳定退款单号分别展示；第二笔成功，第一笔超时标结果确认中并主动查询，不能当失败重试。是否重复退款unknown。",
          "challenge": "后端相关者指出两次是否同一业务操作和远端是否已执行不能由请求序号决定。",
          "revision": "前端用请求身份保护显示，同时使用稳定业务操作键；超时结果标未知并查询/对账，不把忽略响应当作撤销副作用。",
          "result": "held"
        }
      },
      "outcome_status": "held"
    },
    {
      "role_id": "backend-expert",
      "display_name": "陆行远 · 可靠服务官",
      "clones": [
        {"role": "experience_miner", "conclusion": "拆开领取所有权、本地回写和远端副作用，幂等键稳定于业务操作。"},
        {"role": "boundary_challenger", "conclusion": "租约和本地事务不能撤销远端副作用，也不应给无状态查询强加复杂状态机。"},
        {"role": "transfer_architect", "conclusion": "用事实归属、重试身份、下游能力和未知恢复路径迁移可靠性经验。"}
      ],
      "business_stakeholder": {
        "role_id": "product-manager",
        "question": "业务如何定义同一次操作，未知扣款由谁在多长时间内处理，是否真的要求exactly-once？",
        "response": "先定义稳定业务操作ID、可接受重复/延迟和人工对账SLA；仅查询不能关闭并发窗口，仍需唯一裁决、原子claim或下游幂等契约。"
      },
      "experience_unit": {
        "trigger": "租约重领、消息重试或跨系统副作用出现不确定结果",
        "signals": ["业务操作身份", "本地所有权", "下游去重与查询能力", "fencing支持", "对账责任"],
        "decision": "局部原子性不能外推跨系统恰好一次；未知结果需要有界恢复。",
        "action": ["分离三个事实边界", "固定幂等键", "核验下游契约", "有限重试", "查询对账或人工处置"],
        "evidence": [
          {"level": "reviewed_case", "path": "employees/backend-expert/KNOWLEDGE.md", "claim": "跨系统副作用与幂等边界"},
          {"level": "reviewed_case", "path": "learning/2026-09-11-remaining-roles-retraining.md", "claim": "租约接管和重复扣款案例"}
        ],
        "limits": "mock或沙箱不证明生产契约；远端不校验时本地fencing无效。",
        "counterexample": "无状态只读查询不因重试存在就需要outbox、租约和复杂状态机。",
        "transfer_test": {
          "variation_axes": ["支付副作用变文件导出", "下游无去重但可查询结果"],
          "question": "导出服务超时，本地租约到期被重领；下游不能幂等但可按请求指纹查询，如何避免重复生成？",
          "initial_answer": "用稳定业务指纹先查询下游；领取、本地回写和远端导出分开。查询与执行非原子时无法保证零重复，unknown则停止自动重试并对账。",
          "challenge": "产品相关者指出旧worker不会因租约到期自动停止，且重复导出有成本。",
          "revision": "调用前后按稳定指纹查询只能缩小风险；若无唯一裁决、原子claim或下游幂等契约，停止宣称零重复并进入有界人工处置。",
          "result": "held"
        }
      },
      "outcome_status": "held"
    },
    {
      "role_id": "design-master",
      "display_name": "苏映雪 · 信任设计官",
      "clones": [
        {"role": "experience_miner", "conclusion": "将建议、确认、执行、成功和失败分阶段，并明确取消与结果反馈。"},
        {"role": "boundary_challenger", "conclusion": "系统不支持撤销时不能设计虚假撤销；已知缺陷不能写成unknown。"},
        {"role": "transfer_architect", "conclusion": "从副作用生效点、补偿能力、用户风险和授权者四轴迁移。"}
      ],
      "business_stakeholder": {
        "role_id": "frontend-expert",
        "question": "后端只能在执行前取消、执行后不可逆，你的交互如何避免让用户误以为随时可撤销？",
        "response": "先由业务与后端确认30秒窗口、发送生效点和不可撤回契约；未确认前只给条件式流程，不宣称系统已支持。"
      },
      "experience_unit": {
        "trigger": "AI或高风险操作包含不可逆副作用、原稿冲突或状态反馈",
        "signals": ["副作用生效点", "取消与补偿能力", "目标用户", "已知缺陷", "决策授权者"],
        "decision": "交互承诺必须与真实系统能力一致，视觉一致与风险验收分开。",
        "action": ["分阶段描述操作", "列出可取消点", "区分已知缺陷与未知", "提交原稿还原和风险备选供授权者裁决"],
        "evidence": [